"No.","Time","Source","Destination","Protocol","Length","Info"
"1","0.000000000","157.240.214.60","10.0.2.15","TLSv1.2","131","Application Data"
"2","0.053742426","10.0.2.15","157.240.214.60","TCP","54","40198  >  443 [ACK] Seq=1 Ack=78 Win=65535 Len=0"
"3","0.366729406","10.0.2.15","34.104.35.123","TCP","54","35596  >  80 [ACK] Seq=1 Ack=1 Win=62780 Len=0"
"4","0.367372604","34.104.35.123","10.0.2.15","TCP","60","[TCP ACKed unseen segment] 80  >  35596 [ACK] Seq=1 Ack=2 Win=65535 Len=0"
"5","1.595099762","172.217.22.46","10.0.2.15","TLSv1.2","127","Application Data"
"6","1.595578422","10.0.2.15","172.217.22.46","TCP","54","43838  >  443 [FIN, ACK] Seq=1 Ack=74 Win=62780 Len=0"
"7","1.596283245","172.217.22.46","10.0.2.15","TCP","60","443  >  43838 [ACK] Seq=74 Ack=2 Win=65535 Len=0"
"8","1.609400287","172.217.22.46","10.0.2.15","TCP","60","443  >  43838 [FIN, ACK] Seq=74 Ack=2 Win=65535 Len=0"
"9","1.609427546","10.0.2.15","172.217.22.46","TCP","54","43838  >  443 [ACK] Seq=2 Ack=75 Win=62780 Len=0"
"10","1.925048699","157.240.214.60","10.0.2.15","TLSv1.2","131","Application Data"
"11","1.925065728","10.0.2.15","157.240.214.60","TCP","54","40198  >  443 [ACK] Seq=1 Ack=155 Win=65535 Len=0"
"12","2.412510165","10.0.2.15","172.253.126.94","TCP","54","51546  >  443 [ACK] Seq=1 Ack=1 Win=62780 Len=0"
"13","2.413017113","172.253.126.94","10.0.2.15","TCP","60","[TCP ACKed unseen segment] 443  >  51546 [ACK] Seq=1 Ack=2 Win=65535 Len=0"
"14","2.990030497","157.240.214.60","10.0.2.15","TLSv1.2","131","Application Data"
"15","2.990069435","10.0.2.15","157.240.214.60","TCP","54","40198  >  443 [ACK] Seq=1 Ack=232 Win=65535 Len=0"
"16","4.436224156","10.0.2.15","157.240.214.60","TLSv1.2","124","Application Data"
"17","4.436687247","157.240.214.60","10.0.2.15","TCP","60","443  >  40198 [ACK] Seq=232 Ack=71 Win=65535 Len=0"
"18","5.385900186","10.0.2.15","157.240.214.60","TLSv1.2","124","Application Data"
"19","5.386659469","157.240.214.60","10.0.2.15","TCP","60","443  >  40198 [ACK] Seq=232 Ack=141 Win=65535 Len=0"
"20","5.553340436","10.0.2.15","157.240.214.60","TLSv1.2","270","Application Data"
"21","5.554028013","157.240.214.60","10.0.2.15","TCP","60","443  >  40198 [ACK] Seq=232 Ack=357 Win=65535 Len=0"
"22","5.570427071","157.240.214.60","10.0.2.15","TLSv1.2","126","Application Data"
"23","5.570449367","10.0.2.15","157.240.214.60","TCP","54","40198  >  443 [ACK] Seq=357 Ack=304 Win=65535 Len=0"
"24","5.798262044","157.240.214.60","10.0.2.15","TLSv1.2","165","Application Data"
"25","5.798295560","10.0.2.15","157.240.214.60","TCP","54","40198  >  443 [ACK] Seq=357 Ack=415 Win=65535 Len=0"
"26","6.143984123","157.240.214.60","10.0.2.15","TLSv1.2","150","Application Data"
"27","6.143999800","10.0.2.15","157.240.214.60","TCP","54","40198  >  443 [ACK] Seq=357 Ack=511 Win=65535 Len=0"
"28","6.147268940","10.0.2.15","157.240.214.60","TLSv1.2","149","Application Data"
"29","6.147876950","157.240.214.60","10.0.2.15","TCP","60","443  >  40198 [ACK] Seq=511 Ack=452 Win=65535 Len=0"
"30","6.507481473","10.0.2.15","142.250.27.188","TCP","54","50082  >  5228 [ACK] Seq=1 Ack=1 Win=62780 Len=0"
"31","6.511246451","142.250.27.188","10.0.2.15","TCP","60","[TCP ACKed unseen segment] 5228  >  50082 [ACK] Seq=1 Ack=2 Win=65535 Len=0"
"32","6.630082097","157.240.214.60","10.0.2.15","TLSv1.2","149","Application Data"
"33","6.660802432","10.0.2.15","213.57.22.5","DNS","93","Standard query 0xbad8 A femetrics.grammarly.io OPT"
"34","6.661105928","10.0.2.15","213.57.22.5","DNS","93","Standard query 0xdd7b HTTPS femetrics.grammarly.io OPT"
"35","6.672268411","213.57.22.5","10.0.2.15","DNS","221","Standard query response 0xbad8 A femetrics.grammarly.io A 3.88.126.20 A 23.20.115.37 A 34.201.97.134 A 54.235.186.138 A 18.211.70.132 A 35.173.87.213 A 34.197.133.78 A 35.172.30.232 OPT"
"36","6.673194315","213.57.22.5","10.0.2.15","DNS","180","Standard query response 0xdd7b HTTPS femetrics.grammarly.io SOA ns-1688.awsdns-19.co.uk OPT"
"37","6.673910164","10.0.2.15","157.240.214.60","TCP","54","40198  >  443 [ACK] Seq=452 Ack=606 Win=65535 Len=0"
"38","6.674546674","10.0.2.15","3.88.126.20","TCP","74","36452  >  443 [SYN] Seq=0 Win=64240 Len=0 MSS=1460 SACK_PERM=1 TSval=2531774300 TSecr=0 WS=128"
"39","6.751363427","10.0.2.15","157.240.214.60","TLSv1.2","147","Application Data"
"40","6.752063199","157.240.214.60","10.0.2.15","TCP","60","443  >  40198 [ACK] Seq=606 Ack=545 Win=65535 Len=0"
"41","6.796055252","10.0.2.15","213.57.22.5","DNS","101","Standard query 0x4755 A config.extension.grammarly.com OPT"
"42","6.796206626","10.0.2.15","213.57.22.5","DNS","101","Standard query 0xe114 HTTPS config.extension.grammarly.com OPT"
"43","6.820041839","213.57.22.5","10.0.2.15","DNS","221","Standard query response 0xe114 HTTPS config.extension.grammarly.com CNAME d27xxe7juh1us6.cloudfront.net SOA ns-79.awsdns-09.com OPT"
"44","6.820499653","10.0.2.15","213.57.22.5","DNS","100","Standard query 0xfe15 HTTPS d27xxe7juh1us6.cloudfront.net OPT"
"45","6.833031336","213.57.22.5","10.0.2.15","DNS","180","Standard query response 0xfe15 HTTPS d27xxe7juh1us6.cloudfront.net SOA ns-79.awsdns-09.com OPT"
"46","6.835593813","3.88.126.20","10.0.2.15","TCP","60","443  >  36452 [SYN, ACK] Seq=0 Ack=1 Win=65535 Len=0 MSS=1460"
"47","6.835631493","10.0.2.15","3.88.126.20","TCP","54","36452  >  443 [ACK] Seq=1 Ack=1 Win=64240 Len=0"
"48","6.836340890","10.0.2.15","3.88.126.20","TLSv1.2","571","Client Hello"
"49","6.837243649","3.88.126.20","10.0.2.15","TCP","60","443  >  36452 [ACK] Seq=1 Ack=518 Win=65535 Len=0"
"50","6.871030231","213.57.22.5","10.0.2.15","DNS","208","Standard query response 0x4755 A config.extension.grammarly.com CNAME d27xxe7juh1us6.cloudfront.net A 13.226.2.52 A 13.226.2.61 A 13.226.2.120 A 13.226.2.114 OPT"
"51","6.872573073","10.0.2.15","13.226.2.52","TCP","74","50522  >  443 [SYN] Seq=0 Win=64240 Len=0 MSS=1460 SACK_PERM=1 TSval=417836659 TSecr=0 WS=128"
"52","6.885154856","13.226.2.52","10.0.2.15","TCP","60","443  >  50522 [SYN, ACK] Seq=0 Ack=1 Win=65535 Len=0 MSS=1460"
"53","6.885191411","10.0.2.15","13.226.2.52","TCP","54","50522  >  443 [ACK] Seq=1 Ack=1 Win=64240 Len=0"
"54","6.885789193","10.0.2.15","13.226.2.52","TLSv1.3","571","Client Hello"
"55","6.886829320","13.226.2.52","10.0.2.15","TCP","60","443  >  50522 [ACK] Seq=1 Ack=518 Win=65535 Len=0"
"56","6.898829484","13.226.2.52","10.0.2.15","TLSv1.3","288","Server Hello, Change Cipher Spec, Application Data, Application Data"
"57","6.898851962","10.0.2.15","13.226.2.52","TCP","54","50522  >  443 [ACK] Seq=518 Ack=235 Win=64006 Len=0"
"58","6.899592759","10.0.2.15","13.226.2.52","TLSv1.3","118","Change Cipher Spec, Application Data"
"59","6.900247757","13.226.2.52","10.0.2.15","TCP","60","443  >  50522 [ACK] Seq=235 Ack=582 Win=65535 Len=0"
"60","6.900384621","10.0.2.15","13.226.2.52","TLSv1.3","152","Application Data"
"61","6.900614883","13.226.2.52","10.0.2.15","TCP","60","443  >  50522 [ACK] Seq=235 Ack=680 Win=65535 Len=0"
"62","6.901642212","10.0.2.15","13.226.2.52","TLSv1.3","622","Application Data"
"63","6.902148444","13.226.2.52","10.0.2.15","TCP","60","443  >  50522 [ACK] Seq=235 Ack=1248 Win=65535 Len=0"
"64","6.910327653","13.226.2.52","10.0.2.15","TLSv1.3","271","Application Data, Application Data"
"65","6.910512994","10.0.2.15","13.226.2.52","TLSv1.3","85","Application Data"
"66","6.911142553","13.226.2.52","10.0.2.15","TCP","60","443  >  50522 [ACK] Seq=452 Ack=1279 Win=65535 Len=0"
"67","6.913207139","13.226.2.52","10.0.2.15","TLSv1.3","419","Application Data"
"68","6.913768961","10.0.2.15","13.226.2.52","TLSv1.3","89","Application Data"
"69","6.914420620","13.226.2.52","10.0.2.15","TCP","60","443  >  50522 [ACK] Seq=817 Ack=1314 Win=65535 Len=0"
"70","6.949870716","157.240.214.60","10.0.2.15","TLSv1.2","151","Application Data"
"71","6.949889335","10.0.2.15","157.240.214.60","TCP","54","40198  >  443 [ACK] Seq=545 Ack=703 Win=65535 Len=0"
"72","6.953274292","10.0.2.15","157.240.214.60","TLSv1.2","150","Application Data"
"73","6.954014451","157.240.214.60","10.0.2.15","TCP","60","443  >  40198 [ACK] Seq=703 Ack=641 Win=65535 Len=0"
"74","6.998680742","3.88.126.20","10.0.2.15","TLSv1.2","2974","Server Hello"
"75","6.998701266","10.0.2.15","3.88.126.20","TCP","54","36452  >  443 [ACK] Seq=518 Ack=2921 Win=62780 Len=0"
"76","6.999225859","3.88.126.20","10.0.2.15","TLSv1.2","2561","Certificate, Server Key Exchange, Server Hello Done"
"77","6.999234959","10.0.2.15","3.88.126.20","TCP","54","36452  >  443 [ACK] Seq=518 Ack=5428 Win=61320 Len=0"
"78","7.000048930","10.0.2.15","3.88.126.20","TLSv1.2","180","Client Key Exchange, Change Cipher Spec, Encrypted Handshake Message"
"79","7.000782830","3.88.126.20","10.0.2.15","TCP","60","443  >  36452 [ACK] Seq=5428 Ack=644 Win=65535 Len=0"
"80","7.000900999","10.0.2.15","3.88.126.20","TLSv1.2","159","Application Data"
"81","7.001786162","3.88.126.20","10.0.2.15","TCP","60","443  >  36452 [ACK] Seq=5428 Ack=749 Win=65535 Len=0"
"82","7.001950917","10.0.2.15","3.88.126.20","TLSv1.2","377","Application Data"
"83","7.002333900","3.88.126.20","10.0.2.15","TCP","60","443  >  36452 [ACK] Seq=5428 Ack=1072 Win=65535 Len=0"
"84","7.003179209","10.0.2.15","3.88.126.20","TLSv1.2","653","Application Data"
"85","7.003785418","3.88.126.20","10.0.2.15","TCP","60","443  >  36452 [ACK] Seq=5428 Ack=1671 Win=65535 Len=0"
"86","7.012813041","157.240.214.60","10.0.2.15","TLSv1.2","327","Application Data"
"87","7.068843694","10.0.2.15","157.240.214.60","TCP","54","40198  >  443 [ACK] Seq=641 Ack=976 Win=65535 Len=0"
"88","7.160276580","3.88.126.20","10.0.2.15","TLSv1.2","294","New Session Ticket, Change Cipher Spec, Encrypted Handshake Message, Application Data"
"89","7.160569411","10.0.2.15","3.88.126.20","TLSv1.2","92","Application Data"
"90","7.161097043","3.88.126.20","10.0.2.15","TCP","60","443  >  36452 [ACK] Seq=5668 Ack=1709 Win=65535 Len=0"
"91","7.161810458","3.88.126.20","10.0.2.15","TLSv1.2","92","Application Data"
"92","7.206328010","10.0.2.15","3.88.126.20","TCP","54","36452  >  443 [ACK] Seq=1709 Ack=5706 Win=62780 Len=0"
"93","7.394130224","10.0.2.15","157.240.214.60","TLSv1.2","150","Application Data"
"94","7.403839593","157.240.214.60","10.0.2.15","TCP","60","443  >  40198 [ACK] Seq=976 Ack=737 Win=65535 Len=0"
"95","7.516190933","10.0.2.15","157.240.214.60","TLSv1.2","162","Application Data"
"96","7.524231682","157.240.214.60","10.0.2.15","TCP","60","443  >  40198 [ACK] Seq=976 Ack=845 Win=65535 Len=0"
"97","7.703841475","157.240.214.60","10.0.2.15","TLSv1.2","149","Application Data"
"98","7.703888329","10.0.2.15","157.240.214.60","TCP","54","40198  >  443 [ACK] Seq=845 Ack=1071 Win=65535 Len=0"
"99","8.137668560","157.240.214.60","10.0.2.15","TLSv1.2","176","Application Data"
"100","8.137868818","10.0.2.15","157.240.214.60","TCP","54","40198  >  443 [ACK] Seq=845 Ack=1193 Win=65535 Len=0"
"101","8.141376183","10.0.2.15","157.240.214.60","TLSv1.2","150","Application Data"
"102","8.142055611","157.240.214.60","10.0.2.15","TCP","60","443  >  40198 [ACK] Seq=1193 Ack=941 Win=65535 Len=0"
"103","8.959772294","157.240.214.60","10.0.2.15","TLSv1.2","131","Application Data"
"104","9.003158170","10.0.2.15","157.240.214.60","TCP","54","40198  >  443 [ACK] Seq=941 Ack=1270 Win=65535 Len=0"
"105","10.137763061","157.240.214.60","10.0.2.15","TLSv1.2","311","Application Data"
"106","10.137789471","10.0.2.15","157.240.214.60","TCP","54","40198  >  443 [ACK] Seq=941 Ack=1527 Win=65535 Len=0"
"107","10.309816072","157.240.214.60","10.0.2.15","TLSv1.2","131","Application Data"
"108","10.309835300","10.0.2.15","157.240.214.60","TCP","54","40198  >  443 [ACK] Seq=941 Ack=1604 Win=65535 Len=0"
"109","10.573666782","10.0.2.15","157.240.214.60","TLSv1.2","144","Application Data"
"110","10.574052384","10.0.2.15","157.240.214.60","TLSv1.2","234","Application Data, Application Data"
"111","10.574131377","10.0.2.15","157.240.214.60","TLSv1.2","144","Application Data"
"112","10.574599574","157.240.214.60","10.0.2.15","TCP","60","443  >  40198 [ACK] Seq=1604 Ack=1031 Win=65535 Len=0"
"113","10.574599688","157.240.214.60","10.0.2.15","TCP","60","443  >  40198 [ACK] Seq=1604 Ack=1211 Win=65535 Len=0"
"114","10.574599717","157.240.214.60","10.0.2.15","TCP","60","443  >  40198 [ACK] Seq=1604 Ack=1301 Win=65535 Len=0"
"115","10.574658567","10.0.2.15","157.240.214.60","TLSv1.2","144","Application Data"
"116","10.574804497","10.0.2.15","157.240.214.60","TLSv1.2","234","Application Data, Application Data"
"117","10.574928073","10.0.2.15","157.240.214.60","TLSv1.2","414","Application Data, Application Data, Application Data, Application Data"
"118","10.575266963","157.240.214.60","10.0.2.15","TCP","60","443  >  40198 [ACK] Seq=1604 Ack=1391 Win=65535 Len=0"
"119","10.575274306","10.0.2.15","157.240.214.60","TLSv1.2","144","Application Data"
"120","10.575267042","157.240.214.60","10.0.2.15","TCP","60","443  >  40198 [ACK] Seq=1604 Ack=1571 Win=65535 Len=0"
"121","10.575267072","157.240.214.60","10.0.2.15","TCP","60","443  >  40198 [ACK] Seq=1604 Ack=1931 Win=65535 Len=0"
"122","10.575689735","157.240.214.60","10.0.2.15","TCP","60","443  >  40198 [ACK] Seq=1604 Ack=2021 Win=65535 Len=0"
"123","10.611958434","10.0.2.15","157.240.214.60","TLSv1.2","150","Application Data"
"124","10.612567070","157.240.214.60","10.0.2.15","TCP","60","443  >  40198 [ACK] Seq=1604 Ack=2117 Win=65535 Len=0"
"125","10.696313016","10.0.2.15","157.240.214.60","TCP","7354","40198  >  443 [PSH, ACK] Seq=2117 Ack=1604 Win=65535 Len=7300 [TCP segment of a reassembled PDU]"
"126","10.696440606","10.0.2.15","157.240.214.60","TCP","7354","40198  >  443 [PSH, ACK] Seq=9417 Ack=1604 Win=65535 Len=7300 [TCP segment of a reassembled PDU]"
"127","10.697197674","157.240.214.60","10.0.2.15","TCP","60","443  >  40198 [ACK] Seq=1604 Ack=3577 Win=65535 Len=0"
"128","10.697197802","157.240.214.60","10.0.2.15","TCP","60","443  >  40198 [ACK] Seq=1604 Ack=5037 Win=65535 Len=0"
"129","10.697216020","10.0.2.15","157.240.214.60","TLSv1.2","5894","Application Data [TCP segment of a reassembled PDU]"
"130","10.697197824","157.240.214.60","10.0.2.15","TCP","60","443  >  40198 [ACK] Seq=1604 Ack=6497 Win=65535 Len=0"
"131","10.697197846","157.240.214.60","10.0.2.15","TCP","60","443  >  40198 [ACK] Seq=1604 Ack=7957 Win=65535 Len=0"
"132","10.697197866","157.240.214.60","10.0.2.15","TCP","60","443  >  40198 [ACK] Seq=1604 Ack=9417 Win=65535 Len=0"
"133","10.697403070","10.0.2.15","157.240.214.60","TLSv1.2","4668","Application Data"
"134","10.697197890","157.240.214.60","10.0.2.15","TCP","60","443  >  40198 [ACK] Seq=1604 Ack=10877 Win=65535 Len=0"
"135","10.697197911","157.240.214.60","10.0.2.15","TCP","60","443  >  40198 [ACK] Seq=1604 Ack=12337 Win=65535 Len=0"
"136","10.697197931","157.240.214.60","10.0.2.15","TCP","60","443  >  40198 [ACK] Seq=1604 Ack=13797 Win=65535 Len=0"
"137","10.697886773","157.240.214.60","10.0.2.15","TCP","60","443  >  40198 [ACK] Seq=1604 Ack=15257 Win=65535 Len=0"
"138","10.697886849","157.240.214.60","10.0.2.15","TCP","60","443  >  40198 [ACK] Seq=1604 Ack=16717 Win=65535 Len=0"
"139","10.697886871","157.240.214.60","10.0.2.15","TCP","60","443  >  40198 [ACK] Seq=1604 Ack=18177 Win=65535 Len=0"
"140","10.697886900","157.240.214.60","10.0.2.15","TCP","60","443  >  40198 [ACK] Seq=1604 Ack=19637 Win=65535 Len=0"
"141","10.698899653","157.240.214.60","10.0.2.15","TCP","60","443  >  40198 [ACK] Seq=1604 Ack=21097 Win=65535 Len=0"
"142","10.698899919","157.240.214.60","10.0.2.15","TCP","60","443  >  40198 [ACK] Seq=1604 Ack=22557 Win=65535 Len=0"
"143","10.698899975","157.240.214.60","10.0.2.15","TCP","60","443  >  40198 [ACK] Seq=1604 Ack=24017 Win=65535 Len=0"
"144","10.698900010","157.240.214.60","10.0.2.15","TCP","60","443  >  40198 [ACK] Seq=1604 Ack=25477 Win=65535 Len=0"
"145","10.698900051","157.240.214.60","10.0.2.15","TCP","60","443  >  40198 [ACK] Seq=1604 Ack=26937 Win=65535 Len=0"
"146","10.698900125","157.240.214.60","10.0.2.15","TCP","60","443  >  40198 [ACK] Seq=1604 Ack=27171 Win=65535 Len=0"
"147","10.712552676","10.0.2.15","157.240.214.60","TLSv1.2","159","Application Data"
"148","10.712706598","10.0.2.15","157.240.214.60","TLSv1.2","270","Application Data, Application Data"
"149","10.713239752","157.240.214.60","10.0.2.15","TCP","60","443  >  40198 [ACK] Seq=1604 Ack=27276 Win=65535 Len=0"
"150","10.713254536","10.0.2.15","157.240.214.60","TLSv1.2","269","Application Data, Application Data"
"151","10.713239888","157.240.214.60","10.0.2.15","TCP","60","443  >  40198 [ACK] Seq=1604 Ack=27492 Win=65535 Len=0"
"152","10.714089086","157.240.214.60","10.0.2.15","TCP","60","443  >  40198 [ACK] Seq=1604 Ack=27707 Win=65535 Len=0"
"153","10.770558440","157.240.214.60","10.0.2.15","TLSv1.2","1870","Application Data, Application Data, Application Data, Application Data"
"154","10.770587580","10.0.2.15","157.240.214.60","TCP","54","40198  >  443 [ACK] Seq=27707 Ack=3420 Win=65535 Len=0"
"155","10.770558995","157.240.214.60","10.0.2.15","TLSv1.2","539","Application Data"
"156","10.770948512","10.0.2.15","157.240.214.60","TCP","54","40198  >  443 [ACK] Seq=27707 Ack=3905 Win=65535 Len=0"
"157","10.770559036","157.240.214.60","10.0.2.15","TLSv1.2","1447","Application Data, Application Data"
"158","10.771241751","10.0.2.15","157.240.214.60","TCP","54","40198  >  443 [ACK] Seq=27707 Ack=5298 Win=65535 Len=0"
"159","10.770559063","157.240.214.60","10.0.2.15","TLSv1.2","586","Application Data"
"160","10.771600661","10.0.2.15","157.240.214.60","TCP","54","40198  >  443 [ACK] Seq=27707 Ack=5830 Win=65535 Len=0"
"161","10.770559083","157.240.214.60","10.0.2.15","TLSv1.2","127","Application Data"
"162","10.771953111","10.0.2.15","157.240.214.60","TCP","54","40198  >  443 [ACK] Seq=27707 Ack=5903 Win=65535 Len=0"
"163","10.777779806","157.240.214.60","10.0.2.15","TLSv1.2","497","Application Data"
"164","10.777810736","10.0.2.15","157.240.214.60","TCP","54","40198  >  443 [ACK] Seq=27707 Ack=6346 Win=65535 Len=0"
"165","10.934974851","157.240.214.60","10.0.2.15","TLSv1.2","146","Application Data"
"166","10.935016108","10.0.2.15","157.240.214.60","TCP","54","40198  >  443 [ACK] Seq=27707 Ack=6438 Win=65535 Len=0"
"167","10.934975272","157.240.214.60","10.0.2.15","TLSv1.2","146","Application Data"
"168","10.935205325","10.0.2.15","157.240.214.60","TCP","54","40198  >  443 [ACK] Seq=27707 Ack=6530 Win=65535 Len=0"
"169","10.934975301","157.240.214.60","10.0.2.15","TLSv1.2","152","Application Data"
"170","10.935534221","10.0.2.15","157.240.214.60","TCP","54","40198  >  443 [ACK] Seq=27707 Ack=6628 Win=65535 Len=0"
"171","10.934975330","157.240.214.60","10.0.2.15","TLSv1.2","152","Application Data"
"172","10.935826990","10.0.2.15","157.240.214.60","TCP","54","40198  >  443 [ACK] Seq=27707 Ack=6726 Win=65535 Len=0"
"173","10.934975358","157.240.214.60","10.0.2.15","TLSv1.2","147","Application Data"
"174","10.935960987","10.0.2.15","157.240.214.60","TCP","54","40198  >  443 [ACK] Seq=27707 Ack=6819 Win=65535 Len=0"
"175","11.040428370","157.240.214.60","10.0.2.15","TLSv1.2","4162","Application Data, Application Data"
"176","11.040478960","10.0.2.15","157.240.214.60","TCP","54","40198  >  443 [ACK] Seq=27707 Ack=10927 Win=65535 Len=0"
"177","11.041260319","157.240.214.60","10.0.2.15","TLSv1.2","4140","Application Data"
"178","11.041281444","10.0.2.15","157.240.214.60","TCP","54","40198  >  443 [ACK] Seq=27707 Ack=15013 Win=65535 Len=0"
"179","11.042525272","157.240.214.60","10.0.2.15","TLSv1.2","4140","Application Data"
"180","11.042544230","10.0.2.15","157.240.214.60","TCP","54","40198  >  443 [ACK] Seq=27707 Ack=19099 Win=65535 Len=0"
"181","11.043868768","157.240.214.60","10.0.2.15","TLSv1.2","4140","Application Data"
"182","11.043881819","10.0.2.15","157.240.214.60","TCP","54","40198  >  443 [ACK] Seq=27707 Ack=23185 Win=65535 Len=0"
"183","11.045020283","157.240.214.60","10.0.2.15","TLSv1.2","1567","Application Data"
"184","11.045032859","10.0.2.15","157.240.214.60","TCP","54","40198  >  443 [ACK] Seq=27707 Ack=24698 Win=65535 Len=0"
"185","11.046598287","157.240.214.60","10.0.2.15","TLSv1.2","2374","Application Data, Application Data"
"186","11.046613928","10.0.2.15","157.240.214.60","TCP","54","40198  >  443 [ACK] Seq=27707 Ack=27018 Win=65535 Len=0"
"187","11.186872709","10.0.2.15","157.240.214.60","TLSv1.2","388","Application Data"
"188","11.187667108","157.240.214.60","10.0.2.15","TCP","60","443  >  40198 [ACK] Seq=27018 Ack=28041 Win=65535 Len=0"
"189","11.253299551","10.0.2.15","213.57.22.5","DNS","87","Standard query 0x96fb A pps.whatsapp.net OPT"
"190","11.253935075","10.0.2.15","213.57.22.5","DNS","87","Standard query 0xdef0 HTTPS pps.whatsapp.net OPT"
"191","11.266291368","213.57.22.5","10.0.2.15","DNS","169","Standard query response 0xdef0 HTTPS pps.whatsapp.net CNAME mmx-ds.cdn.whatsapp.net SOA a.ns.cdn.whatsapp.net OPT"
"192","11.266291724","213.57.22.5","10.0.2.15","DNS","128","Standard query response 0x96fb A pps.whatsapp.net CNAME mmx-ds.cdn.whatsapp.net A 157.240.253.60 OPT"
"193","11.266690932","10.0.2.15","213.57.22.5","DNS","94","Standard query 0xfa08 HTTPS mmx-ds.cdn.whatsapp.net OPT"
"194","11.279456662","10.0.2.15","157.240.253.60","QUIC","1292","Initial, DCID=3aae37ca43624769, PKN: 1, PADDING, CRYPTO, PADDING, PING, PADDING, PING, PING, PING, PING, PING, PADDING, CRYPTO, PADDING, CRYPTO, PING, PING, CRYPTO, CRYPTO, CRYPTO, CRYPTO, CRYPTO, PADDING"
"195","11.279959916","10.0.2.15","157.240.253.60","QUIC","120","0-RTT, DCID=3aae37ca43624769"
"196","11.280490571","10.0.2.15","157.240.253.60","QUIC","594","0-RTT, DCID=3aae37ca43624769"
"197","11.281025447","10.0.2.15","157.240.253.60","QUIC","242","0-RTT, DCID=3aae37ca43624769"
"198","11.281434929","10.0.2.15","157.240.253.60","QUIC","244","0-RTT, DCID=3aae37ca43624769"
"199","11.281841219","10.0.2.15","157.240.253.60","QUIC","242","0-RTT, DCID=3aae37ca43624769"
"200","11.284347511","213.57.22.5","10.0.2.15","DNS","151","Standard query response 0xfa08 HTTPS mmx-ds.cdn.whatsapp.net SOA a.ns.cdn.whatsapp.net OPT"
"201","11.286842027","10.0.2.15","157.240.253.60","QUIC","241","0-RTT, DCID=3aae37ca43624769"
"202","11.291861912","157.240.214.60","10.0.2.15","TLSv1.2","311","Application Data"
"203","11.291880949","10.0.2.15","157.240.214.60","TCP","54","40198  >  443 [ACK] Seq=28041 Ack=27275 Win=65535 Len=0"
"204","11.348947001","157.240.253.60","10.0.2.15","QUIC","1274","Initial, SCID=851d009120e3cf5c, PKN: 7899945, CRYPTO, ACK, PADDING"
"205","11.348947281","157.240.253.60","10.0.2.15","QUIC","250","Handshake, SCID=851d009120e3cf5c"
"206","11.349786767","157.240.253.60","10.0.2.15","QUIC","90","Protected Payload (KP0)"
"207","11.349786901","157.240.253.60","10.0.2.15","QUIC","122","Protected Payload (KP0)"
"208","11.349786932","157.240.253.60","10.0.2.15","QUIC","90","Protected Payload (KP0)"
"209","11.350023247","10.0.2.15","157.240.253.60","QUIC","123","Handshake, DCID=851d009120e3cf5c"
"210","11.350171310","10.0.2.15","157.240.253.60","QUIC","76","Protected Payload (KP0), DCID=851d009120e3cf5c"
"211","11.350330815","157.240.253.60","10.0.2.15","QUIC","90","Protected Payload (KP0)"
"212","11.350990722","157.240.253.60","10.0.2.15","QUIC","1274","Protected Payload (KP0)"
"213","11.351176554","10.0.2.15","157.240.253.60","QUIC","81","Protected Payload (KP0), DCID=851d009120e3cf5c"
"214","11.351330707","157.240.253.60","10.0.2.15","QUIC","1274","Protected Payload (KP0)"
"215","11.351330792","157.240.253.60","10.0.2.15","QUIC","1274","Protected Payload (KP0)"
"216","11.351622500","157.240.253.60","10.0.2.15","QUIC","1274","Protected Payload (KP0)"
"217","11.351622585","157.240.253.60","10.0.2.15","QUIC","1274","Protected Payload (KP0)"
"218","11.351943869","157.240.253.60","10.0.2.15","QUIC","1210","Protected Payload (KP0)"
"219","11.353156061","10.0.2.15","157.240.253.60","QUIC","78","Protected Payload (KP0), DCID=851d009120e3cf5c"
"220","11.353482813","10.0.2.15","157.240.253.60","QUIC","82","Protected Payload (KP0), DCID=851d009120e3cf5c"
"221","11.353572537","10.0.2.15","157.240.253.60","QUIC","78","Protected Payload (KP0), DCID=851d009120e3cf5c"
"222","11.353606065","157.240.253.60","10.0.2.15","QUIC","90","Protected Payload (KP0)"
"223","11.353657116","10.0.2.15","157.240.253.60","QUIC","77","Protected Payload (KP0), DCID=851d009120e3cf5c"
"224","11.353939458","10.0.2.15","157.240.253.60","QUIC","76","Protected Payload (KP0), DCID=851d009120e3cf5c"
"225","11.354042725","157.240.253.60","10.0.2.15","QUIC","1274","Protected Payload (KP0)"
"226","11.354042815","157.240.253.60","10.0.2.15","QUIC","1274","Protected Payload (KP0)"
"227","11.354128580","10.0.2.15","157.240.253.60","QUIC","78","Protected Payload (KP0), DCID=851d009120e3cf5c"
"228","11.354244036","10.0.2.15","157.240.253.60","QUIC","80","Protected Payload (KP0), DCID=851d009120e3cf5c"
"229","11.354385976","157.240.253.60","10.0.2.15","QUIC","282","Protected Payload (KP0)"
"230","11.354386057","157.240.253.60","10.0.2.15","QUIC","1274","Protected Payload (KP0)"
"231","11.354474691","10.0.2.15","157.240.253.60","QUIC","78","Protected Payload (KP0), DCID=851d009120e3cf5c"
"232","11.354599710","10.0.2.15","157.240.253.60","QUIC","76","Protected Payload (KP0), DCID=851d009120e3cf5c"
"233","11.375965066","157.240.253.60","10.0.2.15","QUIC","250","Protected Payload (KP0)"
"234","11.375965329","157.240.253.60","10.0.2.15","QUIC","282","Protected Payload (KP0)"
"235","11.375965350","157.240.253.60","10.0.2.15","QUIC","1274","Protected Payload (KP0)"
"236","11.376417399","157.240.253.60","10.0.2.15","QUIC","1274","Protected Payload (KP0)"
"237","11.376794265","10.0.2.15","157.240.253.60","QUIC","80","Protected Payload (KP0), DCID=851d009120e3cf5c"
"238","11.377261642","10.0.2.15","157.240.253.60","QUIC","78","Protected Payload (KP0), DCID=851d009120e3cf5c"
"239","11.378228477","10.0.2.15","157.240.253.60","QUIC","79","Protected Payload (KP0), DCID=851d009120e3cf5c"
"240","11.378648377","10.0.2.15","157.240.253.60","QUIC","77","Protected Payload (KP0), DCID=851d009120e3cf5c"
"241","11.426122079","157.240.253.60","10.0.2.15","QUIC","81","Handshake, SCID=851d009120e3cf5c"
"242","11.426122392","157.240.253.60","10.0.2.15","QUIC","154","Protected Payload (KP0)"
"243","11.426122430","157.240.253.60","10.0.2.15","QUIC","314","Protected Payload (KP0)"
"244","11.426122458","157.240.214.60","10.0.2.15","TLSv1.2","1130","Application Data"
"245","11.426160481","10.0.2.15","157.240.214.60","TCP","54","40198  >  443 [ACK] Seq=28041 Ack=28351 Win=65535 Len=0"
"246","11.426918284","10.0.2.15","157.240.253.60","QUIC","76","Protected Payload (KP0), DCID=851d009120e3cf5c"
"247","11.432553374","157.240.253.60","10.0.2.15","QUIC","90","Protected Payload (KP0)"
"248","11.463626751","157.240.253.60","10.0.2.15","QUIC","250","Protected Payload (KP0)"
"249","11.463627467","157.240.253.60","10.0.2.15","QUIC","1274","Protected Payload (KP0)"
"250","11.463627545","157.240.253.60","10.0.2.15","QUIC","1274","Protected Payload (KP0)"
"251","11.463627575","157.240.253.60","10.0.2.15","QUIC","1274","Protected Payload (KP0)"
"252","11.463627598","157.240.253.60","10.0.2.15","QUIC","698","Protected Payload (KP0)"
"253","11.476765760","10.0.2.15","157.240.253.60","QUIC","81","Protected Payload (KP0), DCID=851d009120e3cf5c"
"254","11.477591150","10.0.2.15","157.240.253.60","QUIC","78","Protected Payload (KP0), DCID=851d009120e3cf5c"
"255","11.478041499","10.0.2.15","157.240.253.60","QUIC","78","Protected Payload (KP0), DCID=851d009120e3cf5c"
"256","11.478361003","10.0.2.15","157.240.253.60","QUIC","77","Protected Payload (KP0), DCID=851d009120e3cf5c"
"257","11.512789581","10.0.2.15","157.240.253.60","QUIC","77","Protected Payload (KP0), DCID=851d009120e3cf5c"
"258","11.571909223","157.240.253.60","10.0.2.15","QUIC","90","Protected Payload (KP0)"
"259","11.575947435","157.240.253.60","10.0.2.15","QUIC","683","Protected Payload (KP0)"
"260","11.576558520","10.0.2.15","157.240.253.60","QUIC","78","Protected Payload (KP0), DCID=851d009120e3cf5c"
"261","11.612380073","10.0.2.15","157.240.214.60","TLSv1.2","150","Application Data"
"262","11.613271670","157.240.214.60","10.0.2.15","TCP","60","443  >  40198 [ACK] Seq=28351 Ack=28137 Win=65535 Len=0"
"263","11.918934917","157.240.214.60","10.0.2.15","TLSv1.2","131","Application Data"
"264","11.918958278","10.0.2.15","157.240.214.60","TCP","54","40198  >  443 [ACK] Seq=28137 Ack=28428 Win=65535 Len=0"
"265","12.394739200","10.0.2.15","213.57.22.5","DNS","87","Standard query 0x6b5a A web.whatsapp.com OPT"
"266","12.395658730","10.0.2.15","213.57.22.5","DNS","87","Standard query 0x3946 HTTPS web.whatsapp.com OPT"
"267","12.406923925","213.57.22.5","10.0.2.15","DNS","140","Standard query response 0x6b5a A web.whatsapp.com CNAME mmx-ds.cdn.whatsapp.net A 157.240.214.60 OPT"
"268","12.407744940","213.57.22.5","10.0.2.15","DNS","178","Standard query response 0x3946 HTTPS web.whatsapp.com CNAME mmx-ds.cdn.whatsapp.net SOA a.ns.cdn.whatsapp.net OPT"
"269","12.407954011","10.0.2.15","213.57.22.5","DNS","94","Standard query 0x976f HTTPS mmx-ds.cdn.whatsapp.net OPT"
"270","12.420805908","213.57.22.5","10.0.2.15","DNS","151","Standard query response 0x976f HTTPS mmx-ds.cdn.whatsapp.net SOA a.ns.cdn.whatsapp.net OPT"
"271","12.421701308","10.0.2.15","157.240.214.60","QUIC","1292","Initial, DCID=0942b14a9e2ec293, PKN: 1, CRYPTO, PADDING, CRYPTO, CRYPTO, PADDING, CRYPTO, CRYPTO, CRYPTO, CRYPTO, PADDING, CRYPTO"
"272","12.422654587","10.0.2.15","157.240.214.60","QUIC","117","0-RTT, DCID=0942b14a9e2ec293"
"273","12.423131708","10.0.2.15","157.240.214.60","QUIC","416","0-RTT, DCID=0942b14a9e2ec293"
"274","12.439744715","10.0.2.15","157.240.214.60","TLSv1.2","144","Application Data"
"275","12.440512839","157.240.214.60","10.0.2.15","TCP","60","443  >  40198 [ACK] Seq=28428 Ack=28227 Win=65535 Len=0"
"276","12.440629656","10.0.2.15","157.240.214.60","TLSv1.2","144","Application Data"
"277","12.441096473","157.240.214.60","10.0.2.15","TCP","60","443  >  40198 [ACK] Seq=28428 Ack=28317 Win=65535 Len=0"
"278","12.450093736","10.0.2.15","157.240.214.60","TLSv1.2","144","Application Data"
"279","12.450690748","157.240.214.60","10.0.2.15","TCP","60","443  >  40198 [ACK] Seq=28428 Ack=28407 Win=65535 Len=0"
"280","12.450798173","10.0.2.15","157.240.214.60","TLSv1.2","144","Application Data"
"281","12.451026120","157.240.214.60","10.0.2.15","TCP","60","443  >  40198 [ACK] Seq=28428 Ack=28497 Win=65535 Len=0"
"282","12.451441654","10.0.2.15","157.240.214.60","TLSv1.2","144","Application Data"
"283","12.451978019","157.240.214.60","10.0.2.15","TCP","60","443  >  40198 [ACK] Seq=28428 Ack=28587 Win=65535 Len=0"
"284","12.458011219","10.0.2.15","157.240.214.60","TLSv1.2","144","Application Data"
"285","12.458407928","157.240.214.60","10.0.2.15","TCP","60","443  >  40198 [ACK] Seq=28428 Ack=28677 Win=65535 Len=0"
"286","12.459252472","10.0.2.15","157.240.214.60","TLSv1.2","144","Application Data"
"287","12.459864940","157.240.214.60","10.0.2.15","TCP","60","443  >  40198 [ACK] Seq=28428 Ack=28767 Win=65535 Len=0"
"288","12.459977571","10.0.2.15","157.240.214.60","TLSv1.2","144","Application Data"
"289","12.460469933","157.240.214.60","10.0.2.15","TCP","60","443  >  40198 [ACK] Seq=28428 Ack=28857 Win=65535 Len=0"
"290","12.460652659","10.0.2.15","157.240.214.60","TLSv1.2","144","Application Data"
"291","12.461374066","157.240.214.60","10.0.2.15","TCP","60","443  >  40198 [ACK] Seq=28428 Ack=28947 Win=65535 Len=0"
"292","12.461479462","10.0.2.15","157.240.214.60","TLSv1.2","144","Application Data"
"293","12.461861768","157.240.214.60","10.0.2.15","TCP","60","443  >  40198 [ACK] Seq=28428 Ack=29037 Win=65535 Len=0"
"294","12.462280352","10.0.2.15","157.240.214.60","TLSv1.2","144","Application Data"
"295","12.462737995","157.240.214.60","10.0.2.15","TCP","60","443  >  40198 [ACK] Seq=28428 Ack=29127 Win=65535 Len=0"
"296","12.462912577","10.0.2.15","157.240.214.60","TLSv1.2","144","Application Data"
"297","12.463143356","157.240.214.60","10.0.2.15","TCP","60","443  >  40198 [ACK] Seq=28428 Ack=29217 Win=65535 Len=0"
"298","12.463572594","10.0.2.15","157.240.214.60","TLSv1.2","144","Application Data"
"299","12.464050650","157.240.214.60","10.0.2.15","TCP","60","443  >  40198 [ACK] Seq=28428 Ack=29307 Win=65535 Len=0"
"300","12.464243305","10.0.2.15","157.240.214.60","TLSv1.2","144","Application Data"
"301","12.464732717","157.240.214.60","10.0.2.15","TCP","60","443  >  40198 [ACK] Seq=28428 Ack=29397 Win=65535 Len=0"
"302","12.478582396","10.0.2.15","157.240.214.60","TLSv1.2","194","Application Data"
"303","12.479309080","157.240.214.60","10.0.2.15","TCP","60","443  >  40198 [ACK] Seq=28428 Ack=29537 Win=65535 Len=0"
"304","12.499180026","157.240.214.60","10.0.2.15","QUIC","1274","Initial, SCID=841d0023454fe797, PKN: 26268, CRYPTO, ACK, PADDING"
"305","12.499180345","157.240.214.60","10.0.2.15","QUIC","1230","Handshake, SCID=841d0023454fe797"
"306","12.499180373","157.240.214.60","10.0.2.15","QUIC","1274","Handshake, SCID=841d0023454fe797"
"307","12.499180421","157.240.214.60","10.0.2.15","QUIC","122","Protected Payload (KP0)"
"308","12.503882326","10.0.2.15","157.240.214.60","QUIC","489","Protected Payload (KP0), DCID=841d0023454fe797"
"309","12.504367096","10.0.2.15","157.240.214.60","QUIC","1292","Handshake, DCID=841d0023454fe797"
"310","12.505944778","10.0.2.15","157.240.214.60","TLSv1.2","159","Application Data"
"311","12.506418110","157.240.214.60","10.0.2.15","TCP","60","443  >  40198 [ACK] Seq=28428 Ack=29642 Win=65535 Len=0"
"312","12.506632177","10.0.2.15","157.240.214.60","TLSv1.2","182","Application Data"
"313","12.506876717","157.240.214.60","10.0.2.15","TCP","60","443  >  40198 [ACK] Seq=28428 Ack=29770 Win=65535 Len=0"
"314","12.532550804","10.0.2.15","157.240.214.60","QUIC","77","Protected Payload (KP0), DCID=841d0023454fe797"
"315","12.572038283","157.240.214.60","10.0.2.15","QUIC","83","Handshake, SCID=841d0023454fe797"
"316","12.572039024","157.240.214.60","10.0.2.15","QUIC","154","Protected Payload (KP0)"
"317","12.572887271","157.240.214.60","10.0.2.15","QUIC","90","Protected Payload (KP0)"
"318","12.572887611","157.240.214.60","10.0.2.15","QUIC","282","Protected Payload (KP0)"
"319","12.573473336","10.0.2.15","157.240.214.60","QUIC","76","Protected Payload (KP0), DCID=841d0023454fe797"
"320","12.574788964","157.240.214.60","10.0.2.15","QUIC","1178","Protected Payload (KP0)"
"321","12.574794762","157.240.214.60","10.0.2.15","QUIC","1274","Protected Payload (KP0)"
"322","12.575456456","10.0.2.15","157.240.214.60","QUIC","78","Protected Payload (KP0), DCID=841d0023454fe797"
"323","12.575883288","10.0.2.15","157.240.214.60","QUIC","80","Protected Payload (KP0), DCID=841d0023454fe797"
"324","12.638681299","157.240.214.60","10.0.2.15","TLSv1.2","982","Application Data, Application Data"
"325","12.638704420","10.0.2.15","157.240.214.60","TCP","54","40198  >  443 [ACK] Seq=29770 Ack=29356 Win=65535 Len=0"
"326","12.638681549","157.240.214.60","10.0.2.15","TLSv1.2","501","Application Data"
"327","12.638776334","10.0.2.15","157.240.214.60","TCP","54","40198  >  443 [ACK] Seq=29770 Ack=29803 Win=65535 Len=0"
"328","12.638681579","157.240.214.60","10.0.2.15","TLSv1.2","501","Application Data"
"329","12.638824735","10.0.2.15","157.240.214.60","TCP","54","40198  >  443 [ACK] Seq=29770 Ack=30250 Win=65535 Len=0"
"330","12.642702006","157.240.214.60","10.0.2.15","TLSv1.2","539","Application Data"
"331","12.642723333","10.0.2.15","157.240.214.60","TCP","54","40198  >  443 [ACK] Seq=29770 Ack=30735 Win=65535 Len=0"
"332","12.644398591","157.240.214.60","10.0.2.15","TLSv1.2","539","Application Data"
"333","12.644416920","10.0.2.15","157.240.214.60","TCP","54","40198  >  443 [ACK] Seq=29770 Ack=31220 Win=65535 Len=0"
"334","12.646618235","157.240.214.60","10.0.2.15","TLSv1.2","986","Application Data, Application Data"
"335","12.646633609","10.0.2.15","157.240.214.60","TCP","54","40198  >  443 [ACK] Seq=29770 Ack=32152 Win=65535 Len=0"
"336","12.648853727","157.240.214.60","10.0.2.15","TLSv1.2","499","Application Data"
"337","12.648867399","10.0.2.15","157.240.214.60","TCP","54","40198  >  443 [ACK] Seq=29770 Ack=32597 Win=65535 Len=0"
"338","12.650368301","157.240.214.60","10.0.2.15","TLSv1.2","1059","Application Data, Application Data, Application Data"
"339","12.650379132","10.0.2.15","157.240.214.60","TCP","54","40198  >  443 [ACK] Seq=29770 Ack=33602 Win=65535 Len=0"
"340","12.651254715","157.240.214.60","10.0.2.15","TLSv1.2","537","Application Data"
"341","12.651269344","10.0.2.15","157.240.214.60","TCP","54","40198  >  443 [ACK] Seq=29770 Ack=34085 Win=65535 Len=0"
"342","12.651775531","157.240.214.60","10.0.2.15","TLSv1.2","127","Application Data"
"343","12.651784387","10.0.2.15","157.240.214.60","TCP","54","40198  >  443 [ACK] Seq=29770 Ack=34158 Win=65535 Len=0"
"344","12.682171560","157.240.214.60","10.0.2.15","TLSv1.2","152","Application Data"
"345","12.682203073","10.0.2.15","157.240.214.60","TCP","54","40198  >  443 [ACK] Seq=29770 Ack=34256 Win=65535 Len=0"
"346","12.682171914","157.240.214.60","10.0.2.15","QUIC","90","Protected Payload (KP0)"
"347","12.692132136","157.240.214.60","10.0.2.15","TLSv1.2","146","Application Data"
"348","12.692152430","10.0.2.15","157.240.214.60","TCP","54","40198  >  443 [ACK] Seq=29770 Ack=34348 Win=65535 Len=0"
"349","12.693165621","157.240.214.60","10.0.2.15","TLSv1.2","146","Application Data"
"350","12.693172853","10.0.2.15","157.240.214.60","TCP","54","40198  >  443 [ACK] Seq=29770 Ack=34440 Win=65535 Len=0"
"351","12.819838776","10.0.2.15","157.240.214.60","TLSv1.2","194","Application Data"
"352","12.820517404","157.240.214.60","10.0.2.15","TCP","60","443  >  40198 [ACK] Seq=34440 Ack=29910 Win=65535 Len=0"
"353","12.821018904","10.0.2.15","157.240.214.60","TLSv1.2","226","Application Data"
"354","12.821356015","157.240.214.60","10.0.2.15","TCP","60","443  >  40198 [ACK] Seq=34440 Ack=30082 Win=65535 Len=0"
"355","12.826447800","10.0.2.15","157.240.214.60","TLSv1.2","159","Application Data"
"356","12.827004460","157.240.214.60","10.0.2.15","TCP","60","443  >  40198 [ACK] Seq=34440 Ack=30187 Win=65535 Len=0"
"357","12.827203260","10.0.2.15","157.240.214.60","TLSv1.2","159","Application Data"
"358","12.827452280","157.240.214.60","10.0.2.15","TCP","60","443  >  40198 [ACK] Seq=34440 Ack=30292 Win=65535 Len=0"
"359","12.827902213","10.0.2.15","157.240.214.60","TLSv1.2","194","Application Data"
"360","12.828138260","157.240.214.60","10.0.2.15","TCP","60","443  >  40198 [ACK] Seq=34440 Ack=30432 Win=65535 Len=0"
"361","12.828558269","10.0.2.15","157.240.214.60","TLSv1.2","227","Application Data"
"362","12.828789943","157.240.214.60","10.0.2.15","TCP","60","443  >  40198 [ACK] Seq=34440 Ack=30605 Win=65535 Len=0"
"363","12.829217464","10.0.2.15","157.240.214.60","TLSv1.2","158","Application Data"
"364","12.829590003","157.240.214.60","10.0.2.15","TCP","60","443  >  40198 [ACK] Seq=34440 Ack=30709 Win=65535 Len=0"
"365","12.836380583","10.0.2.15","157.240.214.60","TLSv1.2","165","Application Data"
"366","12.837195406","157.240.214.60","10.0.2.15","TCP","60","443  >  40198 [ACK] Seq=34440 Ack=30820 Win=65535 Len=0"
"367","12.841410679","10.0.2.15","157.240.214.60","TLSv1.2","165","Application Data"
"368","12.841855114","157.240.214.60","10.0.2.15","TCP","60","443  >  40198 [ACK] Seq=34440 Ack=30931 Win=65535 Len=0"
"369","12.880181874","10.0.2.15","157.240.253.60","QUIC","238","Protected Payload (KP0), DCID=851d009120e3cf5c"
"370","12.897553492","10.0.2.15","157.240.253.60","QUIC","235","Protected Payload (KP0), DCID=851d009120e3cf5c"
"371","12.897970196","10.0.2.15","157.240.253.60","QUIC","234","Protected Payload (KP0), DCID=851d009120e3cf5c"
"372","12.898103154","10.0.2.15","157.240.253.60","QUIC","236","Protected Payload (KP0), DCID=851d009120e3cf5c"
"373","12.898241573","10.0.2.15","157.240.253.60","QUIC","235","Protected Payload (KP0), DCID=851d009120e3cf5c"
"374","12.898365959","10.0.2.15","157.240.253.60","QUIC","234","Protected Payload (KP0), DCID=851d009120e3cf5c"
